{
  "spec": "model-eol/0.1",
  "publisher": "cohere",
  "generated": "2026-09-09T00:22:25.924Z",
  "source": "https://docs.cohere.com/docs/deprecations",
  "models": [
    {
      "id": "embed-english-v2.0",
      "announced": "2026-04-04",
      "shutdown": "2026-04-04",
      "source": "https://docs.cohere.com/docs/deprecations",
      "replacement_note": "Embedding tasks alternatives: embed-english-v3.0, embed-multilingual-v3.0, embed-v4.0; Chat tasks alternatives: command-r7b-12-2024, command-a-03-2025, command-a-reasoning-08-2025"
    },
    {
      "id": "embed-english-light-v2.0",
      "announced": "2026-04-04",
      "shutdown": "2026-04-04",
      "source": "https://docs.cohere.com/docs/deprecations",
      "replacement_note": "Embedding tasks alternatives: embed-english-v3.0, embed-multilingual-v3.0, embed-v4.0; Chat tasks alternatives: command-r7b-12-2024, command-a-03-2025, command-a-reasoning-08-2025"
    },
    {
      "id": "embed-multilingual-v2.0",
      "announced": "2026-04-04",
      "shutdown": "2026-04-04",
      "source": "https://docs.cohere.com/docs/deprecations",
      "replacement_note": "Embedding tasks alternatives: embed-english-v3.0, embed-multilingual-v3.0, embed-v4.0; Chat tasks alternatives: command-r7b-12-2024, command-a-03-2025, command-a-reasoning-08-2025"
    },
    {
      "id": "c4ai-aya-expanse-8b",
      "announced": "2026-04-04",
      "shutdown": "2026-04-04",
      "source": "https://docs.cohere.com/docs/deprecations",
      "replacement_note": "Embedding tasks alternatives: embed-english-v3.0, embed-multilingual-v3.0, embed-v4.0; Chat tasks alternatives: command-r7b-12-2024, command-a-03-2025, command-a-reasoning-08-2025"
    },
    {
      "id": "c4ai-aya-vision-8b",
      "announced": "2026-04-04",
      "shutdown": "2026-04-04",
      "source": "https://docs.cohere.com/docs/deprecations",
      "replacement_note": "Embedding tasks alternatives: embed-english-v3.0, embed-multilingual-v3.0, embed-v4.0; Chat tasks alternatives: command-r7b-12-2024, command-a-03-2025, command-a-reasoning-08-2025"
    },
    {
      "id": "command-r-03-2024",
      "announced": "2025-09-15",
      "source": "https://docs.cohere.com/docs/deprecations",
      "aliases": [
        "command-r"
      ],
      "replacement_options": [
        "command-r-08-2024",
        "command-r-plus-08-2024",
        "command-a-03-2025"
      ],
      "distributions": [
        {
          "via": "aws-bedrock",
          "announced": "2026-02-19",
          "shutdown": "2026-08-19",
          "status": "extended-access",
          "source": "https://docs.aws.amazon.com/bedrock/latest/userguide/model-lifecycle-legacy.html"
        }
      ]
    },
    {
      "id": "command-r-plus-04-2024",
      "announced": "2025-09-15",
      "source": "https://docs.cohere.com/docs/deprecations",
      "aliases": [
        "command-r-plus"
      ],
      "replacement_options": [
        "command-r-08-2024",
        "command-r-plus-08-2024",
        "command-a-03-2025"
      ],
      "distributions": [
        {
          "via": "aws-bedrock",
          "announced": "2026-02-19",
          "shutdown": "2026-08-19",
          "status": "extended-access",
          "source": "https://docs.aws.amazon.com/bedrock/latest/userguide/model-lifecycle-legacy.html"
        }
      ]
    },
    {
      "id": "command-light",
      "announced": "2025-09-15",
      "source": "https://docs.cohere.com/docs/deprecations",
      "replacement_options": [
        "command-r-08-2024",
        "command-r-plus-08-2024",
        "command-a-03-2025"
      ]
    },
    {
      "id": "command",
      "announced": "2025-09-15",
      "source": "https://docs.cohere.com/docs/deprecations",
      "replacement_options": [
        "command-r-08-2024",
        "command-r-plus-08-2024",
        "command-a-03-2025"
      ]
    },
    {
      "id": "summarize",
      "announced": "2025-09-15",
      "source": "https://docs.cohere.com/docs/deprecations"
    },
    {
      "id": "rerank-english-v2.0",
      "announced": "2024-12-02",
      "shutdown": "2025-04-30",
      "source": "https://docs.cohere.com/docs/deprecations",
      "replacement_options": [
        "rerank-v3.5"
      ]
    },
    {
      "id": "rerank-multilingual-v2.0",
      "announced": "2024-12-02",
      "shutdown": "2025-04-30",
      "source": "https://docs.cohere.com/docs/deprecations",
      "replacement_options": [
        "rerank-v3.5"
      ]
    }
  ]
}
